{
  "schema_version": 1,
  "research_date": "2026-08-11",
  "publisher": "Composer",
  "phar_url": "https://getcomposer.org/download/latest-stable/composer.phar",
  "checksum_url": "https://getcomposer.org/download/latest-stable/composer.phar.sha256sum",
  "version_pattern": "^[0-9]+\\.[0-9]+\\.[0-9]+$",
  "target": {
    "platform": "windows",
    "architecture": "amd64",
    "php_directory_template": "{localappdata}\\devkit-wulf\\php",
    "php_executable": "php.exe",
    "php_marker": ".devkit-wulf-artifact.json",
    "phar_name": "composer.phar",
    "wrapper_name": "composer.bat",
    "marker_name": ".devkit-wulf-composer.json",
    "integrity": "sha256-double-read",
    "privileged": false,
    "path_mutation": false
  }
}
